{
  "artifact": "trajectory_meta",
  "schema_version": 1,
  "run_id": "run-20260930-401-n300-dt2-f12-b30-s2",
  "trajectory": {
    "written": false,
    "reason": "no frames were saved"
  },
  "frames_saved": 50,
  "simulated_time": 476.0,
  "steps_taken": 238000,
  "max_single_step_displacement": 2.2695016917075783e-07,
  "stopped_by": "planned_record_reached",
  "stop_outcome": "complete",
  "stopped_early": false,
  "completed_planned_duration": true
}
