{
  "artifact": "trajectory_meta",
  "schema_version": 1,
  "run_id": "run-20260930-401-n300-dt-f6-b12",
  "trajectory": {
    "written": false,
    "reason": "no frames were saved"
  },
  "frames_saved": 50,
  "simulated_time": 502.5,
  "steps_taken": 100500,
  "max_single_step_displacement": 3.5883972497850004e-07,
  "stopped_by": "planned_record_reached",
  "stop_outcome": "complete",
  "stopped_early": false,
  "completed_planned_duration": true
}
